characterName,lineCandace," Hey there, little fella. You're not such a tough guy, are you, Mr. Spider? Aw, no you're not. No, not a bit. Ah, who ya kidding, Flynn? To face your fear, you gotta at least look. (gets creeped out by the spider) Ahh! Creepy crawly, creepy crawly, creepy crawly! Get off me, get off me, get off me, get off me! Ew, ew! I'm sorry, 5-year-old me. I tried. I really tried. (slaps herself) Snap out of it, current me! Summer's not over yet. (looks outside the window) Hey, wait a minute, summer's over? Who did th- oh... Phineas and Ferb. (runs downstairs) Phineas and Ferb, what did you do to summer?!"
Man #2, Your fall is ruining summer.
Woman #2, You made me buy a blanket with sleeves!
Man #3, My toilet seat's cold.
Doofenshmirtz," Ladies and gentlemen of the press, kindly put a cork in it. So you've probably figured out that the Earth has moved away from the sun."
Rodney," And we at L.O.V.E.M.U.F.F.I.N. are responsible. And now, we're here to extort you. And to that end, let me introduce you to Señor Killbot."
Dr. Killbot," ¿Donde esta la biblioteca? (""Where is the library?"")"
Rodney," You know, in case any of you extortees speak Español. We don't want to leave anyone out."
Dr. Killbot," ¿Qué te parece mi bordado? (""Do you like my embroidery?"")"
Audience, Awwww...
Female," Aw, that's cute."
Doofenshmirtz," And that's our new logo. Foreboding, yet comforting. So basically, if you want us to put the Earth back in its proper orbit, you have to meet our list of demands. Number 1: the minimum height to get on any rollercoaster will now be this high. (puts his hand three inches over Dr. Diminutive's head) (Diminutive puts Doof's hand on the very top of Diminutive's head) I mean that high. Number 2: pretzels."
Rodney, Really? That's how you give demands?
Doofenshmirtz, What? What was wrong with that? I was gonna go for one of those big tubs from Lotsmo.
Rodney, You sounded like a bashful Santa Claus pitching softballs to a girl in a bikini.
Doofenshmirtz," Alright, number four... Wait, you don't know what that sounds like!"
Rodney," Stand aside. (pushes Doof away from the podium) Listen, you dogs, with one small inator..."
Doofenshmirtz, My inator!
Rodney," ...we've moved the Earth into an early autumn. Now, we, the collective scientific genius of L.O.V.E.M.U.F.F.I.N., have created an inizer ten times the size and strength! Capable of moving the Earth so far away from the sun, we'll bring about a new ice age! So, if you value your puny lives, you will meet all the demands on our list or pay the consequences!"
Doofenshmirtz, Is it just me or is this getting out of hand?
Dr. Killbot," Quiera lucha tu casa. (""I want to fight your house."")"
Dr. Killbot,Act 4
Candace, Seriously? Someone moved the Earth and it wasn't you?
Phineas," Not this time, no."
Candace, Any chance it could spontaneously go back to the way it was?
Phineas," We can't take that chance, Candace. We'll never have another summer if our plan doesn't work."
Candace, Plan? What plan?
Phineas, We're building this massive rocket engine to put on top of Mount Danville.
Candace," One measly rocket on one mountain isn't going to move the Earth, Phineas."
Phineas," (pointing to a splitscreen monitor) That's why we enlisted the help of other kids around the world. See? There's Floria and Abdul on Mount Kilimanjaro, Ganesh and Kabul on Mt. Everest, Vsevolod and Vanko at the top of Mount Elbrus, and Lupert and Eporwold on Mount Haggenhuge. Eporwold's the goat. While they finish fine-tuning, we'll move our rocket up to Mount Danville."
Candace," Then everyone turns them on, and the Earth goes back to the way it was?"
Phineas," Sort of. But the burners all need to be synchronized through this control panel. Otherwise, we risk ripping the Earth's crust apart. Do you think you could stay here and help control the thrust?"
Candace, These look like simple level controls.
Phineas," Yeah. Pretty much the same as a sound mixer, except this one controls five megarockets capable of ripping the Earth in half."
Candace, Why can't Irving do it?
Phineas," Oh, he would, but he's trending right now."
Irving," ♪ Scorpions, parasites, black widows, rabies! ♪"
Major-in-Charge Carl," (offscreen) Good morning, Agent P."
Major-in-Charge Carl," (different inflection) Good morning, Agent P. (to Agent P) Well, what do you think?"
Monty," Carl, the evil scientists of L.O.V.E.M.U.F.F.I.N. have captured all of our agents!"
Major-in-Charge Carl, Ugh! My first day on the job and all my agents get captured! W-What am I gonna do?
Monty," Simple, let's go get 'em!"
Major-in-Charge Carl, But we're seriously outnumbered!
Monty," Maybe, but we have the advantage! We have the best agent with us and we have the element of surprise! We can't lose!"
Major-in-Charge Carl," You're right! Perry, Monty, let's go rescue our agents! (They leave, but Major-in-Charge Carl tries it again with a different inflection in the mirror.) Let's go rescue our agents. Let's go... (Perry comes back with his hands on his hips.) Oh, I'm coming."
Candace," Oh, there's Kilimanjaro! Phineas, Floria and Abdul's rocket is ready! That's all of them!"
Phineas," (on radio) Great! (cut to outside where the rocket goes out for liftoff) Okay, Candace, we're on our way to Mount Danville! Lock down the capsule and stand by!"
Candace," Oh, I sure hope there aren't any spiders in here."
Phineas," Okay, Ferb, let's put it down right there!"
Phineas," C'mon, everyone! Let's get this thing online!"
Isabella, (opening up a laptop) I'm linking up to the other rockets. Is everyone ready out there? Mount Elbrus?
Vanko, (on laptop) Check.
Isabella, Mount Kilimanjaro?
Abdul, (on laptop) Check.
Isabella, Mount Everest?
Kabul, (on laptop) Check.
Isabella, Mount Haggenhuge? (no response) Mount Haggenhuge?
Eporwold, (bleats on laptop)
Isabella," Uh-oh! Mount Haggenhuge, your rocket has gone offline! Can you fix it?"
Isabella, All systems are green!
Phineas, (on radio) Check! Firing up Mount Danville!
Isabella," Okay, Candace..."
Isabella, (on radio) ...you're good to go!
Candace," Roger! Target destination activated! Engaging thrusters! (She slides the switches up and all the rockets fire up.) Phineas, it's working! The Earth is moving back into position!"
Phineas," Fantastic, Candace! Just a couple more minutes and we'll have our summer back!"
Rodney," Well, that was fun. (closeup to reveal Rodney and Doof carrying the grilled cheese flavored ice cream cones.) We should go get ice cream more often."
Doofenshmirtz," Didja have to order for all of us, Rodney? I'm not crazy about this new grilled cheese flavor."
Rodney, You get what you get and you don't get upset!
Doofenshmirtz," Wow, he's strict!"
Rodney," I think we've given our world leaders enough time. Let's see if they submitted to our list of demands! (He activates the screen and several world leaders, including a dolphin, a Scottsman, a Japanese delegate, President Barack Obama, and a female Indian delegate appear onscreen.) Well, what have you got to say for yourselves?"
President Obama," Uh...you'll be happy to know that we've...uhhhh...met all of your demands, except for the...uhhhhhhh....pretzel thing."
Rodney, What?! How dare you!! Do you know what this means?!
President Obama," Look, we're sorry. Uh...We had them, but the Vice President left the tub on the roof of the car, and we...uhhhhhhhh..."
Rodney," No pretzels, no deal!"
Rodney, (offscreen) You have doomed the Earth to perpetual winter!
Candace," Uh, Phineas, the holographic thingy shows that the Earth is moving in the wrong direction!"
Phineas," Well, that makes no sense. It should be working."
Candace, Maybe it needs more power. I'm increasing the burn!
Phineas," No, Candace, don't!! Never push it into the red! That's a bad thing!! Turn down the thrusters!!!"
Buford, This must be a special episode. He's yelling at his sister again.
Candace," Uh, Phineas, what happened?"
Phineas, You must have overloaded the power relay on the control panel. You're gonna have to get a spare electromagnetic coupling fuse.
Candace, (on radio) Where would I find a thing like that?
Phineas, Ferb has one in a box in the attic.
Candace, (on radio) The attic?! Where all the spiders are?!
Phineas," Yeah, the attic."
Candace, (offscreen) AAAAAAAAAAAAAAAAAAAAAAAAAAAAAAAAAAAAAAAAAAAAAAAAAAAAAAHH!!!
Dr. Diminutive, That's just the building settling again.
Dr. Diminutive,Act 5
Rodney, (offscreen) Now the world knows that L.O.V.E.M.U.F.F.I.N.'s not an organization to be trifled with!
Doofenshmirtz," (offscreen) Yeah, meanwhile, you may have plunged the Earth into another ice age."
Rodney, The world is ours for the taking!
Doofenshmirtz," But this is crazy talk! I-I'm an evil scientist, not a mad scientist! Th-There's a difference! Subtle, I grant you, but, still, y'know, I don't really like the new direction this organization is taking and I think we need a little fresh air. (he walks out)"
Rodney," You also need a chiropractor, Slouchy!"
Dr. Diminutive, Good one! Because he slouches!
Monogram," And as an agent, you get to wear a nifty fedora. I made that one out of an old newspaper. Yes, sir, OWCA is perfect for a guy like you, but-but, sadly, not for me."
Doofenshmirtz," Yeah, things are tough all over, bub."
Monogram, What? Doofenshmirtz?!
Doofenshmirtz," Wait, do...do I know you? (Monogram puts two fingers on his nose where his mustache once was.) Major Monogram? Francis, what happened to you? Look...y-y-y-you're a washed-up mess! This whole weather thing is your fault, you know!"
Monogram, My fault?!
Doofenshmirtz," Okay, technically, it's my fault. But if you weren't sitting around in a cold alley whining to rats and feeling sorry for yourself, this whole situation wouldn't have gotten so out of control! Before, I was a regular evil scientist, and now, suddenly, I'm part of this big organization of supervillains bent on world domination! I'm not comfortable with that! The point is you should've been there to stop me! And you weren't! (He puts two pennies into Monogram's tin cup and walks away.)"
Monogram," (picking up the cup) Huh, two cents."
Monty, There's the warehouse!
Major-in-Charge Carl, Come on!
Major-in-Charge Carl," (grunts) Oh! Guys, little help?"
Monty," What do you say, Perry? Think we can take 'em? (Perry and Monty run up to the goons.) Alright, you goons! (Two more goons appear behind the first two goons.) (to Perry) You take two and I'll take two. (Giant footsteps are heard, which is, clearly, not good news.) Great. They have a cave troll. Run!"
Monty," Perry, split up!"
Monty," Thanks, Carl."
Monty," Wow, good work, Agent P!"
Major-in-Charge Carl, Great! Now we get all his health!
Monty," You play way too many video games, man."
Candace," Come on, Candace, you can do this! What's a couple little spiders compared to the fate of the world? (climbs back down) Oh, who am I kidding?! I need support! (She dials her phone.) Stacy, I really need your help!"
Stacy," (on phone) Sorry, Candace, no can do."
Stacy, I have to stay put until the swelling goes down.
Candace, (on phone) Are you okay?
Stacy," I'll be fine. But until then, you're on your own."
Candace," (hangs up) Well, she's no help. I'm gonna have to do this myself. (climbs back up) It's just you and me, attic. You and me... (climbs back down) and about TEN HUNDRED GAZILLION SPIDERS!! OH, I CAN'T DO THIS!!!"
Doofenshmirtz," Okay, I've had time to think it over and we need to put the world back. I, for one, do not want to live in a perpetual winter! (pushes Rodney) Scoot over, Rodney."
Rodney," Your betrayal doesn't surprise me, Heinz. (pushes Doof) Step aside!"
Doofenshmirtz, (fighting over the controls) Wh-What are you doing?
Rodney," Just to show you who's boss, I'm going to move the Earth even further from the sun!"
Candace," There's Ferb's box way over there. Oh, who am I kidding? I can't go way over there!"
Phineas, Candace?
Candace," AAAAAAHHH! Phineas, how did you get up here?"
Phineas, I'm using the Ferbographic technology.
Phineas, What's taking so long? Did you find the box?
Candace," Well, it's right over there by all those spider webs. Be a pal and grab it for me, will ya?"
Phineas," What? No, I can't pick it up. I'm a hologram. You have to do it."
Candace, But I can't!
Phineas," Well, what's the matter, Candace?"
Candace, It's my fear of spiders. I've been trying to overcome it all day.
Phineas," Well, that is a valid fear. You should be cautious around some spid—"
Candace," Phineas, you're not helping!"
Phineas," Come on, you've already done so many brave things. Remember when you helped us recuse Klimpaloon? And what about that time you got that really big bird to quit pecking our house? Or when you climbed up on the motor of our baguette boat after I gave you a similar pep talk?"
Candace," Yeah! You know what? You're right. (Climbs all the way up.) If I could do that, then I should be able to walk across the attic, right? It's being silly. Heck, I don't even remember what I was afraid of."
Phineas, Spiders.
Candace, AAAAH!!! (climbs back down)
Phineas," Candace, you forgot the box!"
Monty, There they are! They're headin' for the roof! We gotta get up there and stop them from firing that inator!
Dr. Diminutive," (with a pistol) Not so fast, Monty Monogram!"
Monty," Take it easy, we don't want any (attempts to punch but misses) TROUBLE! (backs away) What?"
Dr. Diminutive," Now that we have all of OWCA's agents, nothing can stop us!"
Monogram, (offscreen) That's where you're wrong! (emerges from the shadows)
Major-in-Charge Carl, Major Monogram!
Monogram," I'm back! And I brought some help! (Agent Rat appears on his shoulders and whistles, followed by all of the escaped OWCA agents.)"
Dr. Killbot," ¡Qué lástima! (""What a Pity!"")"
Dr. Diminutive, Wait a minute!!! (record scratch) This is the same brawl we had earlier!
Dr. Bringdown, So?
Dr. Diminutive," Aw, I'm just sayin'."
Dr. Killbot," La cabeza de medusa no es agradable para ver. (""Medusa's head is pleasant to look at."")"
Villain #5, He's right! Let's get out of here!
Villain #6," That's not what he said, but...yes, we should get out of here."
Phineas," Candace, you're not giving up, are you?"
Candace," No. (climbs back up) Today, I face my fear! Back off, spiders! Candace is in the attic!"
Phineas, (offscreen) Now we're talking!
Candace," Ha! Take that, you little... (Several more spiders crawl down from inside the umbrella.) AAAAHHH!!!"
Phineas," Wow, I guess there are a lot of spiders up here."
Phineas," It's all right, Candace. You're just gonna have to reach past that spider."
Candace, Are you kidding me?!
Phineas," Candace, the fate of the world is at stake!"
Candace," Okay, five-year-old me. Here we go. (She timidly sticks her hand into the box, only hesitating for about a second.) Gotta reach it! (The spider sticks out one of its legs.) A little...bit...further! (She grabs the fuse.) That's it! I got it!"
Phineas," Great work, Candace! You go down and put the fuse in, I'll go back and tell the guys! (The hologram disappears, and then reappears.) And well done! (The hologram disappears again.)"
Candace," In your face, arachnid!"
Phineas," Candace did it, Isabella! She got the fuse!"
Isabella," Um, Phineas, one of the main locking bolts came loose on the rocket, and, uh..."
Phineas," Huh. Yeah, we should probably fix that before Candace puts the fuse back."
Rodney," Oh, this is just ridiculous! You and I should just... (points somewhere) Oh, look! A Horse in a Bookcase!"
Doofenshmirtz, A what?
Rodney, Ha! Now to move the Earth into a new ice age!
Candace," Why isn't this thing going in? What is it? ""Righty-loosey, tighty-whitey?"""
Buford," Phineas, this thing ain't budgin'!"
Phineas, Candace? Candace? (to Isabella) Why isn't this com-link working?
Isabella, The rocket is blocking the signal! We've got to get up there!
Rodney, There. I've disabled the reverse switch and the self-destruct button. So there's no—
Doofenshmirtz," Nobody messes with my self-destruct button! (He sticks the mop's handle into the inizer and tries to lift it up.) You make a pretty good fulcrum there, Rodney."
Isabella," Well, at least we're out of danger."
Phineas, We've gotta get the rocket in position or the planet could be torn apart!
Candace," C'mon, you stupid thing! Get in there!"
Candace, It's in!
Candace," (on radio) The fuse is in! Okay, I'm gonna fire up the engines!"
Candace," It's not moving, Phineas! It's like something's resisting our jets!"
Phineas," I was afraid of that! Listen, push the rockets up..."
Phineas, (on radio) ...above the red line!
Candace," But, Phineas, you said that would be bad!"
Phineas," (on radio) Well, there is a..."
Phineas, ....slight chance of pulling the planet apart!
Candace, That's a bad thing!
Phineas," It's our only chance, Candace! We should be okay if we just do it slow and steady!"
Candace," Oh, just like the rabbit in the story."
Phineas," Yes, exact— Wait, no! Like the turtle! Like the turtle!"
Candace, Slow and steady. Slow and steady. (She pushes the levers up slow and steady into the red and the rockets get more powerful.)
Major-in-Charge Carl," Look, Doofenshmirtz is trying to destroy the inator!"
Monogram, Come on! He needs help!
Major-in-Charge Carl," Hang on, sir!"
Monty," Nice catch, Carl!"
Roger, I don't know what's going on anymore.
Candace," Phineas, what's happening?"
Phineas," Unless I've missed my guess, the Earth is moving again! You better shut down the rockets, Candace!"
Candace, Gotta get to the controls! Almost th— AAHHH! (She falls over backwards.)
Phineas," It stopped. We're not moving anymore! Candace, you did it!!"
Candace," What? I did? (She gets up to see that she pulled the plug.) Oh, what do you know? I did it! (She opens the door and smiles as she sees the snow melting.) Aw, summer. Welcome back! (The inator lands in the backyard and takes the control panel with it.) Yeah. Well, that's to be expected."
Monty," Come on, Roddenstein! You're comin' with me!"
Rodney," (to Doof) See ya later, Slouchy!"
Doofenshmirtz," Yeah, well y— Ugh! I can never come up with anything quick enough!"
Monogram," Doofenshmirtz, you just saved the world. Thank you."
Doofenshmirtz," You're welcome, Francis. Put 'er there! (Monogram holds his hand out, but Doof pulls his away) Psych! (laughs) I'm still evil! (walks away laughing)"
Monogram," Yes. Yes, you are."
Colonel Contraction," Well, Monogram, nice work."
Monogram," Thank you, sir."
Colonel Contraction," Unfortunately, we're still not getting our deposit back on that rental hall and that's really broken the budget. I'm afraid we have to close OWCA."
Major-in-Charge Carl," Sir, why don't you start a new agency?"
Monogram, Good idea! What do we call it?
Major-in-Charge Carl," (checks his phone) Oh, looks like the name ""OWCA"" just became available! Oh, and so did their old building!"
Monogram, Great! We'll call our new organization that and move there!
Major-in-Charge Carl," Good idea, sir!"
Monogram," And to keep costs down, we're gonna have to cut some management positions. Colonel Contraction, your services will no longer be required."
Colonel Contraction," Yeah, well, that's to be expected."
Carl," I think this belongs to you, sir."
Major Monogram," You keep that one, Carl. (He concentrates and instantly grows back his mustache.)"
Carl," Welcome back, sir."
Lawrence, Everything's all right. We're all outside.
Saul," Oh, sweet sunshine! (kneels to the ground) Terra firma!"
Lawrence," Yes, well..."
Saul, (kisses the ground) Lovely top soil!
Lawrence," We'll, uh, just be going then, shall we?"
Linda," Bye, Saul!"
Saul, Mwah! Mwah! Mwah! Ugh! Kissed a bug!
Phineas," There she is, the hero of the day! Nice going, Candace! Hey, where'd the command center go?"
Candace, Probably the same place the last one went.
Baljeet," You really did a good job, Candace."
Candace," Yeah, and not only did we save the world, but I did everything I promised five-year-old me I'd do!"
Buford, Let's all pretend like we understood that!
Phineas," Well, now that we have summer back, what should we do?"
Buford, Oh! Oh! I got an idea!
Phineas," ♪ Come on, ev'ryone! ♪"
Band and Crowd, ♪ We're havin' a party! ♪
Phineas, ♪ Dancin' in the sun! ♪
Band and Crowd, ♪ We're havin' a party! ♪
Phineas, ♪ And you know we're not done! ♪
Band and Crowd, ♪ We're havin' a party! ♪
Phineas," ♪ Ev'ry corner of the world, yeah! ♪"
All but Ferb," ♪ 'Cause it's summer, summer all over the-- ♪"
Everyone but Ferb, Buford!!!
Buford, I think there must be somethin' wrong with this program.
