characterName,lineNapoleon, And (jumps on the button) copy! Everyone smile for the camera. (The copier scans them) Excellent! Now we just have to wait for the toner to do its work.
Napoleon,"Wendell Wow, it's a good thing that lid didn't fall on us. That would've hurt."
Napoleon," Well, yes, Wendell, that was fortune..."
Doofenshmirtz," Y'know, it, uh... It could've been worse. Uh, don't..don't all thank me at once. Knowing my talent has served my fellow agents is thanks enough."
Maggie, Rawk! Lousy rescue!
Doofenshmirtz," I wouldn't call it lousy, per se. A little off, maybe, but... Oh, come on. Harry the Hyena, it was a good rescue, wasn't it?"
Harry," A-hee-ha-ha-ha-ha! A-ha-ha-ha ha ha ha ha. Eh, heh heh... Eh... Nah."
Doofenshmirtz," Karen the Cat? Anything? Uh, no? What did you think of the rescue, Perry the— (Perry throws the training manual at Doof) Ow! (Perry takes off in his jet pack) Hey, Perry the Platypus, you're leaving us?!"
Doofenshmirtz," (shooing the letters away) Knock it off! Hope that's not permanent. Oh, I get it! H-Hey, hey, you guys, come back. Come back! Now, let me just explain."
Doofenshmirtz,"Wait a minute, guys. Bear with me just a second here, okay. Watch this, ready?"
Doofenshmirtz,"Oh, that was easier than I thought it would be. If only we had a ""W"", we could spell out ""teamwork""."
Maggie, Macaw!
Doofenshmirtz," (gasps) That's right! ""Macaw"" has a ""W"" in it! So we can do it! Okay, here, from the beginning."
Doofenshmirtz,"Okay, big finish!"
Doofenshmirtz,"Okay, now let's spell out ""collaborative alliance""."
Doofenshmirtz,"No, no, no, I'm just kiddin'! I'm kidding! Come on back! Hey, uh, guys, you, y-you forgot the cat. (to Karen) They forgot you. And you're the cat."
Carl," There it is, sir! The escape pod!"
Major Monogram, Great! Let's get outta here!
Carl," Okay, sir, but be careful. There's a huge set of stairs."
Major Monogram," (sarcastically) Well, that went well."
Carl," Sarcasm isn't helping, sir."
Major Monogram," Aw, there we go— Aw, ow! Ow! Ow! Ow!"
Carl," Okay, this button launches the escape pod."
Major Monogram," (offscreen) Uh, Carl, how does the escape hatch work with, you know, this whole lockdown thing?"
Carl, (offscreen) Uhhh...
Major Monogram, Owwwwwww.
Parenthesis," Well, well, well, Francis Monogram! It's hostile takeover time!"
Major Monogram," Carl, how was he able to override the lockdown?"
Carl," Well, it opens from the outside, sir."
Major Monogram, Ehhh.
Major Monogram,Act V
Major Monogram," Okay, you made your point, Parenthesis. Apparently, I didn't notice you in school. Sad story. Boo-hoo. But why are you here?"
Parenthesis, I'm here to make your days the darkest of grays and your nights the blackest of black. I want to see your smug smile melt away like the candles on a sad little abandoned birthday cake.
Carl, Sounds like he's here to bore us to death.
Parenthesis," As soon as my mecha-fleas completely override your agents' natural instincts, I will release them out into the unsuspecting world, where they will wreak havoc. And all you'll be able to do is sit and watch as the people of the world grow to deride and despise Francis Monogram and his monstrous OWCA as much as I do!!"
Carl, (to Monogram) How about now?
Major Monogram," No, I still don't remember him!"
Wendell," Wow, Napoleon, we're huge!"
Napoleon," Yes, this is bound to get us noticed."
Wendell, So how do we get them to see it?
Napoleon," Well, it would be preferable if it were at their eye level."
Floyd, We could build a paper airplane.
Napoleon," If we could find a staple remover, some dental floss... Wait, Floyd, what did you say?"
Floyd, I want a monkey?
Napoleon," No, what did you just say?"
Floyd, I want a monkey.
Napoleon, What were the last words out of your mouth?
Wendell," Well, actually, those were the last words out of his mouth. You asked him, ""What did you say?"" And he said, ""I want a monkey."" He said it twice, if you count this last time."
Napoleon," Well, I...I... Okay, Floyd, immediately before you said ""I want a monkey"" twice..."
Floyd, I don't want two monkeys.
Wendell, Is this about the face shoe?
Napoleon," Oh, forget it! We're making a paper airplane!"
Parenthesis," Almost out of time! The suspense is delicious, don't you think? (laughs)"
Major Monogram," Hey, Parenthesis, I wouldn't get too comfortable if I were you. Heh heh."
Parenthesis, What?
Major Monogram," Nice upholstery job, Agent P! We got this guy. You take down Parenthesis."
Parenthesis," Agents, you know what to do."
Agent E, (trumpets)
Parenthesis, Excellent! Soon all this will be mine! First thing I'll do is put that sofa back there on the atrium where it belongs. Then I'll—
Carl," Oh, my gosh!"
Carl, Does that mean what I think it means?
Major Monogram, No. It means Parenthesis was... a robot.
Carl," Alright. Well, now I'm confused. What did you think I thought it meant?"
Napoleon, There. This seems aerodynamically sound.
Wendell, Now all we need is a big rubber band and two palm trees to launch us!
Napoleon," You watch way too much TV, Wendell."
Wendell," Oh, just the one show."
Napoleon," But, perhaps some form of propulsion would be beneficial. (Looks at the fan.) Hmmm."
Floyd," Uh, guys. (cut to reveal Floyd's head not attached to his body) I think I got a paper cut."
Napoleon," Uh, Wendell."
Wendell, I'll go get the gauze.
Major Monogram," Well, I guess that's that. We should get that remote device and... (looks inside the body) Whoa! (the robot body grabs Monogram, and pushes Carl, and Perry onto the sofa.) Oh, no, I can't. (The robot body lifts Monogram up in the air so he can see inside.) What?"
Parenthesis, (laughs maniacally) Aloha!
Major Monogram, Wait. You're a flea?
Parenthesis, Recognize me now?
Major Monogram, Why would I recognize a flea?
Parenthesis," See? See? There's that attitude again! (A TV set with multiple mechanical arms pops out of the robot's body. The TV shows the flea's face.) You've always looked down your nose at me. Well, now, who's beneath who?"
Parenthesis," He's getting away! He'll ruin everything! Hold these, guys. Susan, Jim, Tracy, Connie, you're with me!"
Wendell," Napoleon, how are you steering this?"
Napoleon," I'm not, Wendell. We are at the mercy of the wind! YEEHAW!!"
Parenthesis, Get him!
Parenthesis, Where did the platypus go? (gasps) Connie! There you go. Lemme just straighten your collar. To the freeway!
Parenthesis," How about a little oncoming traffic, you portentous platypus?"
Parenthesis, Yes! Finish him!
Parenthesis, What's this?
Parenthesis," Here, little semi--aquatic mammal. Here, boy. Nowhere to turn now! Oh, look, I'm wearing glasses. I'm a hipster."
Parenthesis," Okay, end of the line, platypus! You've nowhere to... Oooh, cotton candy! Give me some of that!"
Parenthesis," Does anyone see him? He's small, teal, wears a hat. Oh, come on. How hard is it to find a small platypus in a carnival setting? Don't say it! I just heard myself."
Doofenshmirtz," Oh, yeah! Great throw, Harry!"
Harry, Ha ha ha ha ha!
Maggie, (squawks)
Parenthesis, Whoa!
Maggie," Mmm, got it!"
Doofenshmirtz, Woohoo!
Harry, Yeah!
Doofenshmirtz," Thanks for believing in your team, Perry the Platypus."
Parenthesis," You think this cage can stop me?! (tears the gate off, grabs the agents and laughs) I have you now!"
Doofenshmirtz," Oh, great! Karen's here! We're saved!"
Maggie, We're dead!
Doofenshmirtz," Gwan, Karen, do your thing."
Parenthesis," Oh. I forgot the feline. Susan, Jim, Tracy, Connie, take the cat out."
Karen, Reeeeor!
Parenthesis, What?! No! You'll pay for that!
Parenthesis, Wah! (gasps) My slipper! Ahh! NO!
Karen, (screeches)
Parenthesis," Hey! Ow! Aw! Ow! (sighs) Oh, well, you guys do work well together. But to no avail. I may be boo-boo'd and bruised, but I still have control over OWCA's agents! Ha! And it all becomes permanent in just five more seconds! (something is heard falling from the sky. It is the fan falling on Parenthesis)"
Wendell," Hey, Napoleon, our motor came off."
Doofenshmirtz, (gathering the flea with tweezers) And gotcha!
Major Monogram," Well done, team! You've earned those black hat bands. You are now officially OWCA agents!"
Wendell," Look, Napoleon. They got to be agents."
Napoleon," Yes, and not us. (The plane begins to plummet.) Whoa! (sighs) We should take this as a sign. (takes up a violin) Bugs are not meant to be agents. (plays ""Nearer My God to Thee"") Gentlemen, it's been a pleasure serving with you. (The wind carries them off.) Whoa!"
Doofenshmirtz," Oh, hey, now that we're agents, when do I get to use this thing? (launches a rocket launcher) Whoa! (The rockets crash into the OWCA headquarters.) Oops, sorry."
Major Monogram, Carl?
Carl," There's still money in the budget, sir."
Napoleon, I don't believe it! We've landed safely! I take this as a sign! We will be the best agents that OWCA has everyday!
